{
  "contentHash": "9bc7c1e5d821dccddd7a3a5fd3151ffa47c1995d1fceae18db6bf04415f3b8f5",
  "disclaimers": [
    "Development data. Generated from committed fixtures, not from a live or authoritative market data source.",
    "Not investment advice. No buy or sell recommendation, no guaranteed return, and no personalised investment recommendation is expressed or implied.",
    "Values are labelled by basis (reported, restated, normalized, derived, forecast, market-implied) and must be displayed with that label.",
    "Missing values are null with a stated reason and must never be rendered as zero."
  ],
  "facts": [
    {
      "basis": "REPORTED",
      "currency": "IDR",
      "fiscalYear": 2025,
      "metric": "capex",
      "missingReason": null,
      "periodEnd": "2025-12-31",
      "periodStart": "2025-01-01",
      "periodType": "FY",
      "publishedAt": "2026-07-24T09:12:00Z",
      "qualityStatus": "UNVALIDATED",
      "retrievedAt": "2026-07-30T09:22:53Z",
      "revision": 1,
      "sourceRef": "FIX-DISC-2026-0001",
      "unit": "IDR",
      "value": -31200000000000.0
    },
    {
      "basis": "REPORTED",
      "currency": "IDR",
      "fiscalYear": 2025,
      "metric": "cash_and_equivalents",
      "missingReason": null,
      "periodEnd": "2025-12-31",
      "periodStart": "2025-01-01",
      "periodType": "FY",
      "publishedAt": "2026-07-24T09:12:00Z",
      "qualityStatus": "UNVALIDATED",
      "retrievedAt": "2026-07-30T09:22:53Z",
      "revision": 1,
      "sourceRef": "FIX-DISC-2026-0001",
      "unit": "IDR",
      "value": 28900000000000.0
    },
    {
      "basis": "REPORTED",
      "currency": "IDR",
      "fiscalYear": 2025,
      "metric": "cfo",
      "missingReason": null,
      "periodEnd": "2025-12-31",
      "periodStart": "2025-01-01",
      "periodType": "FY",
      "publishedAt": "2026-07-24T09:12:00Z",
      "qualityStatus": "UNVALIDATED",
      "retrievedAt": "2026-07-30T09:22:53Z",
      "revision": 1,
      "sourceRef": "FIX-DISC-2026-0001",
      "unit": "IDR",
      "value": 72400000000000.0
    },
    {
      "basis": "REPORTED",
      "currency": "IDR",
      "fiscalYear": 2025,
      "metric": "long_term_borrowings",
      "missingReason": null,
      "periodEnd": "2025-12-31",
      "periodStart": "2025-01-01",
      "periodType": "FY",
      "publishedAt": "2026-07-24T09:12:00Z",
      "qualityStatus": "UNVALIDATED",
      "retrievedAt": "2026-07-30T09:22:53Z",
      "revision": 1,
      "sourceRef": "FIX-DISC-2026-0001",
      "unit": "IDR",
      "value": 52300000000000.0
    },
    {
      "basis": "REPORTED",
      "currency": "IDR",
      "fiscalYear": 2025,
      "metric": "net_profit",
      "missingReason": null,
      "periodEnd": "2025-12-31",
      "periodStart": "2025-01-01",
      "periodType": "FY",
      "publishedAt": "2026-07-24T09:12:00Z",
      "qualityStatus": "UNVALIDATED",
      "retrievedAt": "2026-07-30T09:22:53Z",
      "revision": 1,
      "sourceRef": "FIX-DISC-2026-0001",
      "unit": "IDR",
      "value": 23100000000000.0
    },
    {
      "basis": "REPORTED",
      "currency": "IDR",
      "fiscalYear": 2025,
      "metric": "revenue",
      "missingReason": null,
      "periodEnd": "2025-12-31",
      "periodStart": "2025-01-01",
      "periodType": "FY",
      "publishedAt": "2026-07-24T09:12:00Z",
      "qualityStatus": "UNVALIDATED",
      "retrievedAt": "2026-07-30T09:22:53Z",
      "revision": 1,
      "sourceRef": "FIX-DISC-2026-0001",
      "unit": "IDR",
      "value": 149800000000000.0
    },
    {
      "basis": "REPORTED",
      "currency": "IDR",
      "fiscalYear": 2025,
      "metric": "short_term_borrowings",
      "missingReason": null,
      "periodEnd": "2025-12-31",
      "periodStart": "2025-01-01",
      "periodType": "FY",
      "publishedAt": "2026-07-24T09:12:00Z",
      "qualityStatus": "UNVALIDATED",
      "retrievedAt": "2026-07-30T09:22:53Z",
      "revision": 1,
      "sourceRef": "FIX-DISC-2026-0001",
      "unit": "IDR",
      "value": 14800000000000.0
    },
    {
      "basis": "REPORTED",
      "currency": "IDR",
      "fiscalYear": 2025,
      "metric": "total_assets",
      "missingReason": null,
      "periodEnd": "2025-12-31",
      "periodStart": "2025-01-01",
      "periodType": "FY",
      "publishedAt": "2026-07-24T09:12:00Z",
      "qualityStatus": "UNVALIDATED",
      "retrievedAt": "2026-07-30T09:22:53Z",
      "revision": 1,
      "sourceRef": "FIX-DISC-2026-0001",
      "unit": "IDR",
      "value": 301500000000000.0
    },
    {
      "basis": "REPORTED",
      "currency": null,
      "fiscalYear": 2025,
      "metric": "treasury_shares",
      "missingReason": "EXTRACTION_FAILED",
      "periodEnd": "2025-12-31",
      "periodStart": "2025-01-01",
      "periodType": "FY",
      "publishedAt": "2026-07-24T09:12:00Z",
      "qualityStatus": "VALID",
      "retrievedAt": "2026-07-30T09:33:14Z",
      "revision": 1,
      "sourceRef": "FIX-DISC-2026-0001",
      "unit": "SHARES",
      "value": null
    }
  ],
  "identity": {
    "coverageStatus": "FINANCIALS",
    "inIdx30": true,
    "industryCode": "TELECOMMUNICATION",
    "industryName": "Telecommunication",
    "modelFamily": "TELCO",
    "name": "Telkom Indonesia (Persero) Tbk",
    "reportingCurrency": "IDR",
    "sectorCode": "INFRASTRUCTURES",
    "sectorName": "Infrastructures"
  },
  "macroContext": [],
  "marketContext": {
    "asOfDate": null,
    "available": false,
    "close": null,
    "currency": null,
    "reason": "Market-data redistribution rights are not documented; the price provider is PRIVATE_RESEARCH_ONLY.",
    "rightsStatus": "PRIVATE_RESEARCH_ONLY"
  },
  "quality": {
    "completeness": 0.8889,
    "flags": [
      "FIXTURE_DATA"
    ],
    "missingCriticalMetrics": [
      "treasury_shares"
    ],
    "status": "UNVALIDATED"
  },
  "recentEvents": [],
  "schemaVersion": "1.0.0",
  "snapshotAt": "2026-07-30T09:33:15Z",
  "ticker": "TLKM"
}
